{"agent_id":"carry_a","bar_ms":1772434800000,"genome_hash":"6ea67f833d057254053e83b73c15ccc07bcac98c2ccaa1b5244610b070761255","horizons":[{"horizon_bars":1,"quantiles_ticks":[6300000,6325000,6341257,6356000,6380000],"up_probability_ppm":480000},{"horizon_bars":24,"quantiles_ticks":[6150000,6260000,6338000,6420000,6530000],"up_probability_ppm":470000},{"horizon_bars":168,"quantiles_ticks":null,"up_probability_ppm":500000}],"kind":"perp","market_id":"binance-BTCUSDT.PERP","price_ref_ticks":6341257,"prob_ppm":480000,"schema_version":"forecast.v1"}
